{
  "schema_version": 1,
  "name": "pynq_z2",
  "vendor": "xilinx",
  "part": "xc7z020clg400-1",
  "top": "fpga_top",
  "clock": {
    "frequency_hz": 125000000,
    "differential": false,
    "soc_frequency_hz": 50000000
  },
  "constraints": [
    "constraints/pins.xdc",
    "constraints/clocks.xdc",
    "constraints/cdc.xdc"
  ]
}
