{
  "schema_version": 1,
  "name": "kintex7_competition",
  "vendor": "xilinx",
  "part": "xc7k325tffg900-2",
  "top": "fpga_top",
  "clock": {
    "frequency_hz": 200000000,
    "differential": true,
    "soc_frequency_hz": 200000000
  },
  "constraints": [
    "constraints/pins.xdc",
    "constraints/clocks.xdc",
    "constraints/cdc.xdc"
  ]
}
